{
  "$schema": "http://json-schema.org/draft-07/schema#",
  "$id": "ultron.common.envelope/1.1",
  "title": "BlackGATE common message envelope v1.1",
  "type": "object",
  "required": [
    "schema",
    "schema_version",
    "message_id",
    "gateway_id",
    "gateway_boot_id",
    "gateway_ip",
    "rack_id",
    "gateway_sequence",
    "created_at",
    "created_at_us",
    "replayed",
    "payload"
  ],
  "properties": {
    "schema": { "type": "string", "pattern": "^ultron\\.[a-z]+(\\.[a-z]+)+$" },
    "schema_version": { "type": "string", "const": "1.1" },
    "message_id": { "type": "string", "format": "uuid" },
    "gateway_id": { "type": "string", "pattern": "^[A-Za-z0-9][A-Za-z0-9._-]*$" },
    "gateway_boot_id": { "type": "string", "format": "uuid" },
    "gateway_ip": {
      "type": "string",
      "pattern": "^(\\d{1,3})\\.(\\d{1,3})\\.(\\d{1,3})\\.(\\d{1,3})$"
    },
    "rack_id": { "type": "integer", "minimum": 0 },
    "gateway_sequence": { "type": "integer", "minimum": 0 },
    "source_controller": {
      "type": "object",
      "required": ["controller_id", "role", "epoch"],
      "properties": {
        "controller_id": { "type": "integer" },
        "role": { "type": "string", "enum": ["ACTIVE", "STANDBY"] },
        "epoch": { "type": "integer", "minimum": 0 }
      }
    },
    "created_at": { "type": "string", "format": "date-time" },
    "created_at_us": { "type": "string", "pattern": "^[0-9]+$" },
    "replayed": { "type": "boolean" },
    "payload": { "type": "object" }
  }
}
