{
  "schema": "ultron.measurement.batch",
  "schema_version": "1.1",
  "message_id": "73c9e810-15de-4c84-9d80-e2f2f53a5010",
  "gateway_id": "GW-001",
  "gateway_boot_id": "b0a61c39-91af-4ac3-8b10-a7f4319eae57",
  "gateway_ip": "192.168.50.10",
  "rack_id": 1,
  "gateway_sequence": 100,
  "created_at": "2026-07-16T10:00:05.125200Z",
  "created_at_us": "1784196005125200",
  "replayed": false,
  "payload": {
    "batch_sequence": 12,
    "record_count": 1,
    "records": [
      {
        "slot_id": 1,
        "channel_id": 1,
        "point_id": 100101,
        "card_type": "PROCESS",
        "measurement_type": "TEMPERATURE",
        "value": 82.4,
        "unit": "degC",
        "quality": "GOOD",
        "freshness": "FRESH",
        "source_timestamp_us": "1784196005120000",
        "source_sequence": 501,
        "configuration_revision": 4,
        "calibration_revision": 2
      }
    ]
  }
}
